title,content,img,user
Receta de Spaghetti Carbonara,"La receta clásica de Spaghetti Carbonara es un plato italiano simple pero delicioso. Para prepararla, necesitas 200 gramos de spaghetti, 100 gramos de panceta, 2 huevos, 50 gramos de queso parmesano, sal y pimienta. Cocina los spaghetti al dente, fría la panceta hasta que esté crujiente, luego mezcla los huevos, el queso parmesano, la sal y la pimienta. Combina todo y ¡disfruta",https://th.bing.com/th/id/R.864bd24bb219feaf6ecaf7ba979fe3d2?rik=Inc5cfrZ%2fwLbgA&riu=http%3a%2f%2fwww.servicom.es%2fwp-content%2fuploads%2f2019%2f08%2fespaguetis-a-la-carbonara-1068x712.jpg&ehk=C6qoUh9te8xaSi4Sh4lcDu3oVHM5tH0fmCOSLaVksaE%3d&risl=&pid=ImgRaw&r=0,14
Consejos para un Asado Perfecto,"Un buen asado es una tradición en muchos lugares del mundo. Para lograr un asado perfecto, elige cortes de carne de calidad, como el lomo o el costillar. Asegúrate de precalentar la parrilla y mantener una temperatura constante. También, sazona la carne con sal y pimienta antes de cocinar. No olvides dejarla descansar antes de cortarla para que los jugos se redistribuyan. ¡Tu asado será un éxito!",https://th.bing.com/th/id/OIP.oUHOwR7cLsDvRBGVBSszewHaEc?pid=ImgDet&rs=1,1
Receta de Ensalada César,"La Ensalada César es un plato fresco y delicioso. Necesitarás lechuga romana, croutons, queso parmesano, pechuga de pollo a la parrilla y aderezo César. Lava y corta la lechuga, luego añade los croutons y el queso parmesano. Corta la pechuga de pollo en tiras y colócala sobre la ensalada. Finalmente, adereza con la salsa César y disfruta de una ensalada increíble",https://th.bing.com/th/id/R.0e47bea21234f8bfce32028f101ba5c1?rik=9py2KaDirMXRug&pid=ImgRaw&r=0,15
Receta de Sushi Casero,"Hacer sushi en casa es más fácil de lo que piensas. Necesitarás arroz para sushi, alga nori, pescado fresco, aguacate, pepino y vinagre de arroz. Extiende una capa delgada de arroz sobre el alga nori, añade tiras de pescado, aguacate y pepino. Enrolla el sushi con cuidado y córtalo en rodajas. Sirve con salsa de soja y wasabi. ¡Listo para disfrutar!",https://www.clara.es/medio/2019/11/18/como-hacer-sushi-paso-a-paso_8dbed754_1280x720.jpg,15
Receta de Tarta de Manzana,"La tarta de manzana es un postre clásico y reconfortante. Para prepararla, necesitarás masa para tarta, manzanas, azúcar, canela y mantequilla. Forra un molde con la masa, corta las manzanas en rodajas finas y colócalas en el molde. Espolvorea azúcar y canela por encima, y añade trozos de mantequilla. Hornea hasta que esté dorada. ¡Una delicia para compartir!",https://th.bing.com/th/id/OIP.A-U3bwLXXJADznX_yGyldwHaEX?pid=ImgDet&rs=1,14
Receta de Guacamole,"El guacamole es un acompañamiento mexicano clásico y delicioso. Necesitarás aguacates maduros, cebolla, tomate, cilantro, jugo de limón y sal. Tritura los aguacates y mezcla con cebolla picada, tomate en cubos, cilantro fresco picado, jugo de limón y una pizca de sal. Sirve con nachos o como complemento para tacos. ¡Una delicia cremosa y picante!",https://th.bing.com/th/id/R.126128ad081e25ec89005eb8b76332d7?rik=uGIKI9syLkluDg&pid=ImgRaw&r=0,15
Consejos para Hornear el Pan Perfecto,"Hornear pan en casa es gratificante. Utiliza harina de calidad, levadura fresca y sigue una receta confiable. Amasa la masa hasta que esté elástica, luego déjala reposar y crecer. Precalienta el horno y hornea a la temperatura adecuada. Un truco: agrega un recipiente con agua en el horno para crear vapor. Disfruta del aroma y sabor del pan recién horneado",https://th.bing.com/th/id/OIP.dTbe9KgJBkQFVgsgufnHEAHaFj?pid=ImgDet&rs=1,1
Receta de Risotto de Champiñones,"El risotto de champiñones es un plato italiano cremoso y reconfortante. Requiere arroz Arborio, champiñones, cebolla, caldo de pollo, vino blanco, queso parmesano y mantequilla. Saltea la cebolla y los champiñones, añade el arroz y cocina con vino blanco. Agrega el caldo de pollo poco a poco hasta que el arroz esté cremoso. Termina con queso parmesano y mantequilla. ¡Un lujo!",https://th.bing.com/th/id/R.1ef28d38acc9ac6c6b6ce733aca8357d?rik=xxmymc5meZvzTg&pid=ImgRaw&r=0,15
Receta de Tacos de Pescado,"Los tacos de pescado son una deliciosa opción de comida rápida. Necesitarás filetes de pescado blanco, harina, huevo, pan rallado, tortillas de maíz y salsa de yogur. Pasa el pescado por harina, huevo y pan rallado, luego fríelo hasta que esté dorado. Sirve en tortillas de maíz con lechuga y salsa de yogur. ¡Sabor fresco y crujiente en cada bocado!",https://mujerejecutiva.com.mx/wp-content/uploads/2020/03/Tacos-de-pescado-con-crema-de-lima.jpg,17
Consejos para Organizar tu Cocina,"Una cocina organizada es esencial para cocinar eficientemente. Designa áreas específicas para diferentes tipos de utensilios y alimentos. Etiqueta los contenedores de almacenamiento para saber qué hay dentro. Limpia y ordena regularmente para evitar el desorden. Mantén tus especias al alcance de la mano. Con una cocina organizada, cocinar será mucho más fácil y agradable.",https://th.bing.com/th/id/R.df8d33dcb40533c1ac017840611aa9c0?rik=dB%2ffw5QRtX%2bXeg&pid=ImgRaw&r=0,18
Receta de Sopa de Tomate Casera,"Una sopa de tomate casera es perfecta para los días fríos. Necesitarás tomates maduros, cebolla, ajo, caldo de verduras, albahaca y aceite de oliva. Sofría la cebolla y el ajo, agregue los tomates y el caldo, cocine y mezcle. Termine con hojas de albahaca y un chorrito de aceite de oliva. ¡Una sopa reconfortante en menos de 30 minutos!",https://th.bing.com/th/id/R.395f589bda4c830a3dd5b33b2c742ecf?rik=Bz9ai2OG0e3ELA&pid=ImgRaw&r=0,19
Consejos para Hacer una Barbacoa Exitosa,"La barbacoa es una tradición en muchas culturas. Asegúrate de tener un buen equipo, controla la temperatura y elige madera o carbón de calidad. Sazona la carne con anticipación y utiliza un termómetro para cocinar a la temperatura adecuada. No te olvides de las salsas y los aderezos. ¡Disfruta de una barbacoa deliciosa en tu propio patio!",https://th.bing.com/th/id/OIP.DRM-TWg4LLViN0ZR61JgagHaE8?pid=ImgDet&rs=1,20
Receta de Tiramisú,"El tiramisú es un postre italiano clásico. Necesitarás café, bizcochos de soletilla, queso mascarpone, huevos, azúcar y cacao en polvo. Sumerge los bizcochos en café, colócalos en un recipiente, luego mezcla el queso mascarpone, los huevos y el azúcar. Alterna capas de bizcochos y crema. Espolvorea con cacao en polvo y refrigera. ¡Un postre indulgente!",https://th.bing.com/th/id/OIP.MFaV7ax6MKEvXdD6u_LZvgHaE8?pid=ImgDet&rs=1,21
Receta de Enchiladas de Pollo,"Las enchiladas de pollo son un plato mexicano sabroso. Cocina pechuga de pollo con especias, luego desmenúzala. Rellena tortillas de maíz con el pollo, añade salsa roja y queso. Hornea hasta que el queso se derrita. Sirve con guarniciones como guacamole y crema agria. ¡Un festín de sabor latino en tu mesa!",https://th.bing.com/th/id/R.928c81361d0fa9bed588c0db2d19f062?rik=kpwsA%2fK4JIJkDw&pid=ImgRaw&r=0,22
Consejos para un Desayuno Saludable,"El desayuno es la comida más importante del día. Incluye proteínas, granos enteros y frutas. Opta por huevos, avena y yogur. Evita los cereales azucarados y los alimentos procesados. Bebe agua o jugo natural. Un desayuno saludable te dará energía para afrontar el día",https://th.bing.com/th/id/R.52d2cf8d13d6e4505bd9eedc20cb6d82?rik=ZOXcHbpG8%2fhkow&pid=ImgRaw&r=0,23
Receta de Pollo al Curry,"El pollo al curry es un plato aromático de la India. Necesitarás pollo, cebolla, ajo, jengibre, tomate, leche de coco y especias como comino y cúrcuma. Sofríe la cebolla, el ajo y el jengibre, agrega el pollo y las especias, luego el tomate y la leche de coco. Cocina a fuego lento hasta que el pollo esté tierno. Sirve con arroz o naan. ¡Un viaje culinario exquisito!",https://th.bing.com/th/id/OIP.l2bCYMzF2rnxC7WBoVfnwQHaHa?pid=ImgDet&rs=1,24
Receta de Brownies de Chocolate,"Los brownies de chocolate son un placer irresistible. Necesitarás chocolate, mantequilla, azúcar, huevos, harina y cacao en polvo. Derrite el chocolate y la mantequilla, agrega azúcar, huevos y harina. Mezcla bien y hornea. Los brownies deben quedar húmedos en el centro. ¡Un capricho para los amantes del chocolate",https://th.bing.com/th/id/R.a3759dddd2b43302a65b54ce12f57762?rik=%2fd47qKsV%2fUBhuw&pid=ImgRaw&r=0,25
Consejos para Elegir el Vino Perfecto para tu Comida,El maridaje de vinos y comidas puede elevar tu experiencia culinaria. Combina vinos tintos con carnes rojas y blancos con pescado y aves. Los vinos dulces van bien con postres. Experimenta y descubre tus propias combinaciones. Un buen vino puede realzar los sabores de tu plato.,https://th.bing.com/th/id/R.fe101cac56ab3732a92c935b59a2a513?rik=NM27%2fX%2fhgfZy8w&pid=ImgRaw&r=0,26
Receta de Mousse de Mango,"El mousse de mango es un postre tropical y refrescante. Necesitarás mango, gelatina, azúcar, crema batida y jugo de limón. Mezcla el mango con la gelatina y el azúcar, luego agrega la crema batida y el jugo de limón. Refrigera hasta que esté firme. Decora con trozos de mango. ¡Un postre perfecto para el verano!",https://www.mylatinatable.com/wp-content/uploads/2017/08/Mango-Mousse-4-1024x720.jpg,27
Receta de Espárragos a la Parrilla,"Los espárragos a la parrilla son una guarnición saludable y deliciosa. Lava y corta los espárragos, luego asa a la parrilla con aceite de oliva, sal y pimienta. Puedes añadir parmesano rallado y limón antes de servir. Los espárragos a la parrilla son el complemento perfecto para carnes a la parrilla o pescado. ¡Un toque de frescura en tu comida!",https://th.bing.com/th/id/R.17cb538e2d196876666415649e98d722?rik=5lHQFtToe8aHxA&riu=http%3a%2f%2fensalpicadas.com%2fwp-content%2fuploads%2f2019%2f07%2fEsp%C3%A1rragos-a-la-Parrilla-0536-691x900.jpg&ehk=KJe8yy8nPyCSw4dvlva3V72R%2fKY9xLuGjJrFkWYjGos%3d&risl=&pid=ImgRaw&r=0,28
Receta de Risotto de Champiñones,"El risotto de champiñones es una delicia cremosa y reconfortante. Prepara arroz Arborio con caldo de champiñones y agrega champiñones salteados, cebolla, ajo, vino blanco y queso parmesano. Cocina a fuego lento mientras remueves constantemente. Sirve caliente con un toque de perejil fresco. ¡Un plato italiano que deleitará tus papilas gustativas!",https://www.recetin.com/wp-content/uploads/2013/10/risotto_campi%C3%B1on.jpg,29
Consejos para Preparar Sushi en Casa,"Hacer sushi en casa puede ser divertido y delicioso. Asegúrate de tener ingredientes frescos como pescado crudo, aguacate y pepino. Utiliza una esterilla de bambú para enrollar los rollos de sushi. Acompaña con salsa de soja, jengibre encurtido y wasabi. Practica y perfecciona tu técnica para crear obras maestras de sushi",https://th.bing.com/th/id/R.ff017cb95b326225c5b7b362e2528a5f?rik=6xlgNx%2f2lR7YMA&riu=http%3a%2f%2fwww.chilango.com%2fmedia%2f2014%2f09%2f20%2frollo-empanizado.jpg&ehk=p8iTlYBdcFbjo1b4ocFCmuDFfgVkQ6ETTpLc30Ow4%2fI%3d&risl=&pid=ImgRaw&r=0,30
Receta de Tarta de Manzana Casera,"La tarta de manzana casera es un clásico reconfortante. Prepara una masa quebrada, cubre con rodajas de manzana y espolvorea con canela y azúcar. Hornéala hasta que esté dorada y sirve caliente con una bola de helado de vainilla. Esta tarta es perfecta para cualquier ocasión",https://th.bing.com/th/id/R.274e1a42586efb8c1de5c64e2d27a57f?rik=zacK9VgBmNVqog&pid=ImgRaw&r=0,31
Receta de Gazpacho Andaluz,"El gazpacho andaluz es una sopa fría perfecta para el verano. Necesitarás tomates maduros, pimientos, pepinos, ajo, pan duro, aceite de oliva, vinagre y sal. Mezcla todos los ingredientes en una licuadora hasta obtener una consistencia suave. Refrigera durante unas horas antes de servir. Sirve con picatostes. ¡Un plato refrescante y saludable",https://th.bing.com/th/id/OIP.GDaqE6y2X395HdlDgbrSeQHaHa?pid=ImgDet&rs=1,32
Consejos para Cocinar a la Parrilla como un Experto,"La parrilla es una forma maravillosa de cocinar. Prepara la parrilla adecuadamente y asegúrate de que esté bien caliente. Limpia y engrasa las parrillas antes de cocinar. Marina la carne, pollo o verduras con anticipación. Cocina a fuego medio para evitar que se quemen. Gira los alimentos con cuidado. ¡Cocinar a la parrilla es todo un arte!",https://th.bing.com/th/id/R.fe5ee93c0865b1004bf9ecbaeef1f974?rik=8HS0WXWARodX0g&pid=ImgRaw&r=0,33
Receta de Sopa de Lentejas,"La sopa de lentejas es una opción saludable y deliciosa. Necesitarás lentejas, zanahorias, apio, cebolla, ajo, tomate y especias. Cocina las lentejas con las verduras y especias en caldo de verduras. Sirve caliente con pan crujiente. Esta sopa es una fuente de proteínas y fibras.",https://th.bing.com/th/id/OIP.N75IAN0_2dD6XfwWAzREdAAAAA?pid=ImgDet&rs=1,34
Receta de Pollo a la Mostaza,"El pollo a la mostaza es un plato elegante y sabroso. Dora pechugas de pollo en una sartén, luego agrega mostaza Dijon, crema, caldo de pollo y estragón. Cocina a fuego lento hasta que la salsa espese. Sirve con arroz o puré de papas. ¡Un plato que impresionará a tus invitados!",https://th.bing.com/th/id/R.aa57406d51f27821ffdfb483c2b1c53d?rik=c%2fgPw8UmQPVD3Q&pid=ImgRaw&r=0,35
Consejos para un Desayuno Saludable y Rápido,"El desayuno es importante, incluso en días ocupados. Opta por opciones rápidas como yogur con frutas y granola o una tostada de aguacate. Prepara batidos verdes con espinacas y frutas. También puedes hacer avena durante la noche para tener un desayuno listo por la mañana. No subestimes el poder de un desayuno saludable para empezar el día.",https://as01.epimg.net/deporteyvida/imagenes/2020/09/26/portada/1601101750_613778_1601102390_noticia_normal.jpg,36
Consejos para Hornear el Pan Perfecto,"Hornear pan en casa es gratificante. Utiliza harina de calidad, levadura fresca y sigue una receta confiable. Amasa la masa hasta que esté elástica, luego déjala reposar y crecer. Precalienta el horno y hornea a la temperatura adecuada. Un truco: agrega un recipiente con agua en el horno para crear vapor. Disfruta del aroma y sabor del pan recién horneado.",https://th.bing.com/th/id/OIP.QwUqOEvrK20S1QOatREC7QHaE8?pid=ImgDet&rs=1,37
Receta de Risotto de Champiñones,"El risotto de champiñones es un plato italiano cremoso y reconfortante. Requiere arroz Arborio, champiñones, cebolla, caldo de pollo, vino blanco, queso parmesano y mantequilla. Saltea la cebolla y los champiñones, añade el arroz y cocina con vino blanco. Agrega el caldo de pollo poco a poco hasta que el arroz esté cremoso. Termina con queso parmesano y mantequilla. ¡Un lujo!",https://th.bing.com/th/id/R.8976cbe9bc74f6bdd98d1a29944d011e?rik=4tG7W32p3lPUUQ&riu=http%3a%2f%2fwww.gourmet.cl%2fwp-content%2fuploads%2f2012%2f04%2frisotto-de-champinones.jpg&ehk=OAEtWxBcq7mkZ9vpS8mRxnjeshb8W1fzmNDzMn8fPH4%3d&risl=&pid=ImgRaw&r=0,38
Receta de Tacos de Pescado,"Los tacos de pescado son una deliciosa opción de comida rápida. Necesitarás filetes de pescado blanco, harina, huevo, pan rallado, tortillas de maíz y salsa de yogur. Pasa el pescado por harina, huevo y pan rallado, luego fríelo hasta que esté dorado. Sirve en tortillas de maíz con lechuga y salsa de yogur. ¡Sabor fresco y crujiente en cada bocado!",https://th.bing.com/th/id/OIP.BtAbJRxH90IzwtsV_1u4XwHaFG?pid=ImgDet&rs=1,39
Consejos para Organizar tu Cocina,"Una cocina organizada es esencial para cocinar eficientemente. Designa áreas específicas para diferentes tipos de utensilios y alimentos. Etiqueta los contenedores de almacenamiento para saber qué hay dentro. Limpia y ordena regularmente para evitar el desorden. Mantén tus especias al alcance de la mano. Con una cocina organizada, cocinar será mucho más fácil y agradable.",https://th.bing.com/th/id/OIP.8Vlj5tVm1jf4w_70aUxqwwHaDD?pid=ImgDet&rs=1,40
Receta de Sopa de Tomate y Albahaca,"La sopa de tomate y albahaca es una opción reconfortante y saludable. Necesitarás tomates maduros, cebolla, ajo, caldo de verduras, hojas de albahaca fresca y crema. Saltea la cebolla y el ajo, añade los tomates y cocina hasta que se ablanden. Agrega el caldo de verduras y la albahaca, luego mezcla y cocina a fuego lento. Finaliza con crema y sirve caliente.",https://th.bing.com/th/id/OIP.KXXm3KwKDXXCXnRgkVeWVgHaFP?pid=ImgDet&rs=1,41
Consejos para Marinar Carne,"Marinar carne es una forma de darle sabor y jugosidad. Utiliza ingredientes como aceite de oliva, ajo, hierbas, limón y vinagre balsámico. Deja que la carne repose en la marinada durante al menos una hora en el refrigerador. Voltea la carne ocasionalmente para asegurarte de que absorba los sabores de manera uniforme. ¡Prepararás carnes deliciosas y bien sazonadas!",https://i.blogs.es/ca9246/marinado3/1024_2000.jpg,42
Receta de Galletas de Chocolate,"Las galletas de chocolate son un placer para los amantes del dulce. Necesitarás harina, cacao en polvo, chocolate picado, azúcar, mantequilla y huevos. Mezcla los ingredientes secos y húmedos por separado, luego combina todo. Agrega las chispas de chocolate. Forma bolitas y hornea hasta que estén doradas. Disfruta con una taza de leche.",https://th.bing.com/th/id/OIP.0jxxtPAfQBcwbUyXqr5xGQHaE7?pid=ImgDet&rs=1,43
Receta de Enchiladas de Pollo,"Las enchiladas de pollo son un platillo mexicano sabroso. Necesitarás tortillas de maíz, pollo desmenuzado, salsa de enchilada, queso rallado y crema agria. Rellena las tortillas con el pollo, enróllalas y colócalas en una fuente para horno. Cubre con la salsa de enchilada y queso rallado, luego hornea hasta que el queso se derrita. Sirve con crema agria y cilantro fresco.",https://th.bing.com/th/id/OIP.VykDcOV4-oRj2brtmj4cvAHaDX?pid=ImgDet&rs=1,44
"Consejos para Elegir el Mejor Cuchillo de Cocina""","Un buen cuchillo es esencial en la cocina. Busca cuchillos de acero inoxidable de alta calidad que sean cómodos de sostener. Asegúrate de que la hoja esté afilada y sea fácil de afilar. Diferentes cuchillos son ideales para tareas específicas, como pelar, rebanar o deshuesar. Invierte en un conjunto de cuchillos de calidad para facilitar la preparación de tus comidas",https://th.bing.com/th/id/OIP.U9unckOc_T06DA2K1jzyuQHaEK?pid=ImgDet&rs=1,45
Receta de Tiramisú,"El tiramisú es un postre italiano clásico. Necesitarás bizcochos de soletilla, café, queso mascarpone, huevos, azúcar y cacao en polvo. Sumerge los bizcochos en café y colócalos en un recipiente. Mezcla el queso mascarpone con azúcar y yemas de huevo, luego bate las claras a punto de nieve. Alterna capas de bizcochos y mezcla de queso, luego refrigera. Espolvorea cacao en polvo antes de servir.",https://vinomanos.com/wp-content/uploads/2021/02/Tiramisu-min.jpg,46
Consejos para Reducir el Desperdicio de Alimentos,Reducir el desperdicio de alimentos es bueno para tu billetera y el medio ambiente. Planifica tus comidas y compra solo lo que necesitas. Almacena los alimentos correctamente para prolongar su frescura. Aprende a congelar sobras para usar en el futuro. Recicla los restos de comida en compostaje. Pequeñas acciones pueden marcar la diferencia en la lucha contra el desperdicio de alimentos.,https://th.bing.com/th/id/R.e531ca2aae005b1ef5eea32daeece168?rik=2NqVDxDA%2fjj1%2fw&pid=ImgRaw&r=0,47
